{
  "$schema": "https://json-schema.org/draft/2020-12/schema",
  "$id": "https://github.com/ali-baneshi/defi-arbitrage-core/schemas/market_snapshot.schema.json",
  "title": "MarketSnapshot",
  "type": "object",
  "required": ["edges"],
  "additionalProperties": false,
  "properties": {
    "source": {"type": "string", "minLength": 1, "maxLength": 120},
    "network": {"type": "string", "minLength": 1, "maxLength": 64},
    "timestamp": {"type": "string", "pattern": "^\\d{4}-\\d{2}-\\d{2}T\\d{2}:\\d{2}:\\d{2}Z$"},
    "edges": {
      "type": "array",
      "minItems": 1,
      "maxItems": 10000,
      "items": {"$ref": "#/$defs/edge"}
    }
  },
  "$defs": {
    "edge": {
      "type": "object",
      "required": ["source", "target", "rate"],
      "additionalProperties": false,
      "properties": {
        "source": {"type": "string", "minLength": 1, "maxLength": 32},
        "target": {"type": "string", "minLength": 1, "maxLength": 32},
        "rate": {"type": "number", "exclusiveMinimum": 0},
        "venue": {"type": "string", "maxLength": 80},
        "fee_bps": {"type": "number", "minimum": 0, "exclusiveMaximum": 10000},
        "liquidity": {"type": ["number", "null"], "minimum": 0},
        "metadata": {"type": "object"}
      }
    }
  }
}
