{
  "source": "example-no-opportunity",
  "network": "polygon",
  "timestamp": "2026-05-05T00:00:00Z",
  "edges": [
    {"source": "USDC", "target": "WETH", "rate": 0.00025, "venue": "dex-a", "fee_bps": 30, "liquidity": 100000},
    {"source": "WETH", "target": "USDC", "rate": 3950, "venue": "dex-b", "fee_bps": 30, "liquidity": 100000}
  ]
}
